{
  "schemaVersion": "1.0.0",
  "eventId": "22222222-2222-4222-8222-222222222222",
  "timestamp": "2026-04-16T12:36:01.500Z",
  "sessionId": "claude-sess-abc123",
  "epicId": "EPIC-0040",
  "storyId": "story-0040-0001",
  "taskId": "TASK-0040-0001-001",
  "type": "skill.end",
  "skill": "x-story-implement",
  "phase": "Phase-2-Implementation",
  "durationMs": 12345,
  "status": "ok",
  "metadata": {
    "retryCount": 0
  }
}
